[
  {"asset_id": "CHAR_RIVER", "asset_type": "character", "asset_class": "CANONICAL", "display_name": "River", "path": "media/river-reference.txt", "sha256": "905c6cb384420d3a218de79126e87ed013dcac3dcbf5ce1aa7237283a15fc75a", "width": 1000, "height": 1500, "aspect_ratio": 0.6666666667, "mode": "RGBA", "alpha": true, "profile": "CHARACTER_REFERENCE", "state": "LOCKED", "canonical_level": "CANONICAL", "reference_role": "identity", "does_not_control": "camera", "source": "fixture", "episode_scope": ["EPISODE_ONE", "EPISODE_TWO"]},
  {"asset_id": "CHAR_MOSS", "asset_type": "character", "asset_class": "CANONICAL", "display_name": "Moss", "path": "media/moss-reference.txt", "sha256": "df9fe2c9248d8e3da3c6491ef5651a5f0118bed1ff17926dc0c8477f844e4aff", "width": 1000, "height": 1500, "aspect_ratio": 0.6666666667, "mode": "RGBA", "alpha": true, "profile": "CHARACTER_REFERENCE", "state": "LOCKED", "canonical_level": "CANONICAL", "reference_role": "identity", "does_not_control": "camera", "source": "fixture", "episode_scope": ["EPISODE_ONE"]},
  {"asset_id": "LOC_WORKSHOP", "asset_type": "location", "asset_class": "CANONICAL", "display_name": "Workshop", "path": "media/workshop-reference.txt", "sha256": "d7e1265c2a8666fb6486d3f0b359fa48b7375409883fa692c5428b57011332c9", "width": 2000, "height": 1000, "aspect_ratio": 2.0, "mode": "RGB", "alpha": false, "profile": "LOCATION_REFERENCE_WIDE", "state": "LOCKED", "canonical_level": "CANONICAL", "reference_role": "geography", "does_not_control": "identity", "source": "fixture", "episode_scope": ["EPISODE_ONE", "EPISODE_TWO"]},
  {"asset_id": "PROP_LAMP", "asset_type": "prop", "asset_class": "CANONICAL", "display_name": "Lamp", "path": "media/lamp-reference.txt", "sha256": "eed7630e7972e18f613db3f772c303284045673ea7f55420ba6c5115b40ca1c0", "width": 800, "height": 800, "aspect_ratio": 1.0, "mode": "RGBA", "alpha": true, "profile": "PROP_REFERENCE", "state": "LOCKED", "canonical_level": "CANONICAL", "reference_role": "prop state", "does_not_control": "lighting", "source": "fixture", "episode_scope": ["EPISODE_ONE", "EPISODE_TWO"]},
  {"asset_id": "LOOK_DAWN", "asset_type": "look", "asset_class": "SUPPORTING", "display_name": "Dawn Look", "path": "media/dawn-look-reference.txt", "sha256": "2d0c4fd8f57f2fea2491dda26a5a1fe3b437af5e214542c8d4cf90cd455f311a", "width": 1600, "height": 900, "aspect_ratio": 1.7777777778, "mode": "RGB", "alpha": false, "profile": "VISUAL_CONTROL", "state": "LOCKED", "canonical_level": "SUPPORTING", "reference_role": "lighting palette", "does_not_control": "identity", "source": "fixture", "episode_scope": ["EPISODE_ONE", "EPISODE_TWO"]}
]
